{
  "issue_id": "MZ-2026-07-05",
  "issue_title": "The Ones Who Stayed",
  "page_count": 8,
  "pages": [
    {
      "page_number": 1,
      "page_purpose": "Hook — the Wellness Recall arrives; danger meter joke starts",
      "layout_recipe": "half+half",
      "panels": [
        {
          "panel_id": "MZ-2026-07-05_P01_PANEL01",
          "panel_size": "half",
          "characters": ["Moodz", "TwoTone", "Static", "Ash", "NeonBlue", "Scarline"],
          "location": "Zoo City street, night rain, under flickering FusionZoo billboard",
          "camera_angle": "wide establishing, slight low angle",
          "action": "Courier drone drops a glowing pastel envelope into Moodz's mitts; squad huddles under the dying billboard light",
          "emotion": "wary curiosity",
          "dialogue": "",
          "caption": "FusionZoo never calls to say hi.",
          "sfx": "",
          "visual_notes": "Rain sheen scene mode; billboard signage 'FUSIONZOO - UPGRADE YOURSELF' (approved); palettes separated by rain greys; compose in layers (bg plate + two 3-lead groups)",
          "continuity_notes": "Street matches Emo ref #973 backdrop; billboard = Ed.4 signage",
          "art_prompt": "SEE art_prompt_pack.json MZ-2026-07-05_P01_PANEL01",
          "negative_prompt": "SEE art_prompt_pack.json MZ-2026-07-05_P01_PANEL01",
          "references_required": ["references/background_refs/zoo_city_street_plate.png", "03_APPROVED_CANON/approved_characters/ (all six)", "emo.png backdrop ref"],
          "lora_required": [],
          "controlnet_required": "depth",
          "seed_strategy": "per_panel"
        },
        {
          "panel_id": "MZ-2026-07-05_P01_PANEL02",
          "panel_size": "half",
          "characters": ["Static", "TwoTone", "Moodz"],
          "location": "Zoo City street, tight on group",
          "camera_angle": "close-up on notice prop, faces behind",
          "action": "The notice unfolds itself, cheerful pastel type (text applied at lettering)",
          "emotion": "comic dread",
          "dialogue": "STATIC: \"Danger level: four.\" / TWOTONE: \"Of five?\" / STATIC: \"Of four.\"",
          "caption": "",
          "sfx": "",
          "visual_notes": "Notice as blank pastel prop; Static shake lines ON; reserve top fifth for three balloons",
          "continuity_notes": "STARTS running joke: Static's danger meter",
          "art_prompt": "SEE art_prompt_pack.json MZ-2026-07-05_P01_PANEL02",
          "negative_prompt": "SEE art_prompt_pack.json MZ-2026-07-05_P01_PANEL02",
          "references_required": ["03_APPROVED_CANON/approved_characters/static/", "03_APPROVED_CANON/approved_characters/twotone/", "03_APPROVED_CANON/approved_characters/moodz/"],
          "lora_required": [],
          "controlnet_required": "openpose",
          "seed_strategy": "per_panel"
        }
      ]
    },
    {
      "page_number": 2,
      "page_purpose": "Escalate — the Annex door; Moodz leads where he once hesitated",
      "layout_recipe": "third-x3",
      "panels": [
        {
          "panel_id": "MZ-2026-07-05_P02_PANEL01",
          "panel_size": "third",
          "characters": ["Moodz"],
          "location": "Annex wing exterior door, service alley",
          "camera_angle": "medium, from behind Moodz facing the door",
          "action": "Green light bleeds from under a rusted door; Moodz studies his reflection in wet glass",
          "emotion": "quiet dread, resolve forming",
          "dialogue": "",
          "caption": "The Annex is where the truth lives. The marketing lives out front.",
          "sfx": "",
          "visual_notes": "FIRST green glow of issue, confined to door seam; reflection echo of Ed.4",
          "continuity_notes": "Annex established Ed.2; deliberate Ed.4 corridor-reflection echo",
          "art_prompt": "SEE art_prompt_pack.json MZ-2026-07-05_P02_PANEL01",
          "negative_prompt": "SEE art_prompt_pack.json MZ-2026-07-05_P02_PANEL01",
          "references_required": ["03_APPROVED_CANON/approved_characters/moodz/", "references/background_refs/annex_alley_plate.png"],
          "lora_required": [],
          "controlnet_required": "depth",
          "seed_strategy": "per_panel"
        },
        {
          "panel_id": "MZ-2026-07-05_P02_PANEL02",
          "panel_size": "third",
          "characters": ["NeonBlue", "Ash"],
          "location": "Annex alley",
          "camera_angle": "two-shot, eye level",
          "action": "NeonBlue bounces on his toes; Ash stares at the glowing door seam",
          "emotion": "clashing readings of the same door",
          "dialogue": "NEONBLUE: \"A free update! That's basically a gift.\" / ASH: \"Gifts knock.\"",
          "caption": "",
          "sfx": "",
          "visual_notes": "NeonBlue glow subtle; Ash hood up half-lidded; balloons top third",
          "continuity_notes": "Ad-copy joke continues; Ash <=4 words rule",
          "art_prompt": "SEE art_prompt_pack.json MZ-2026-07-05_P02_PANEL02",
          "negative_prompt": "SEE art_prompt_pack.json MZ-2026-07-05_P02_PANEL02",
          "references_required": ["03_APPROVED_CANON/approved_characters/neonblue/", "03_APPROVED_CANON/approved_characters/ash/"],
          "lora_required": [],
          "controlnet_required": "openpose",
          "seed_strategy": "per_panel"
        },
        {
          "panel_id": "MZ-2026-07-05_P02_PANEL03",
          "panel_size": "third",
          "characters": ["Moodz"],
          "location": "Annex alley, at the door",
          "camera_angle": "low angle on Moodz's mitt at the door",
          "action": "Moodz pushes the door open into green dark; squad silhouettes behind",
          "emotion": "protective resolve",
          "dialogue": "MOODZ: \"Stay behind me.\"",
          "caption": "",
          "sfx": "",
          "visual_notes": "Door swing spills a wedge of green across panel",
          "continuity_notes": "Arc positioning: Ed.4 he hesitated at a door, now he leads",
          "art_prompt": "SEE art_prompt_pack.json MZ-2026-07-05_P02_PANEL03",
          "negative_prompt": "SEE art_prompt_pack.json MZ-2026-07-05_P02_PANEL03",
          "references_required": ["03_APPROVED_CANON/approved_characters/moodz/", "references/background_refs/annex_alley_plate.png"],
          "lora_required": [],
          "controlnet_required": "openpose",
          "seed_strategy": "per_panel"
        }
      ]
    },
    {
      "page_number": 3,
      "page_purpose": "Reveal — the Stayed; zombie faction on-page debut",
      "layout_recipe": "third-x3",
      "panels": [
        {
          "panel_id": "MZ-2026-07-05_P03_PANEL01",
          "panel_size": "third",
          "characters": ["Moodz", "Static"],
          "location": "Annex corridor interior",
          "camera_angle": "wide, deep one-point perspective down corridor",
          "action": "Squad advances; a green pulse breathes from the far end",
          "emotion": "mounting tension",
          "dialogue": "STATIC: \"Danger level: four point five.\"",
          "caption": "",
          "sfx": "",
          "visual_notes": "Numbered chamber doors; institutional symmetry = menace",
          "continuity_notes": "Corridor = Ed.4 facility design, aged/disused variant",
          "art_prompt": "SEE art_prompt_pack.json MZ-2026-07-05_P03_PANEL01",
          "negative_prompt": "SEE art_prompt_pack.json MZ-2026-07-05_P03_PANEL01",
          "references_required": ["references/background_refs/annex_corridor_plate.png (ESTABLISHING PLATE P00_PLATE01 - generate first)", "03_APPROVED_CANON/approved_characters/moodz/", "03_APPROVED_CANON/approved_characters/static/"],
          "lora_required": [],
          "controlnet_required": "depth",
          "seed_strategy": "per_panel"
        },
        {
          "panel_id": "MZ-2026-07-05_P03_PANEL02",
          "panel_size": "third",
          "characters": ["The Stayed (3-4 faction zombies)"],
          "location": "Annex corridor, further in",
          "camera_angle": "over-shoulder from behind squad",
          "action": "Shambling silhouettes resolve out of the green: exposed brains, stitched bodies, slow orbit-walk",
          "emotion": "reveal — dread with absurdity",
          "dialogue": "THE STAYED: \"MORE.\" \"MORE.\"",
          "caption": "",
          "sfx": "",
          "visual_notes": "Zombies per faction ref #1997; swaying not lunging; tragic-funny not horror",
          "continuity_notes": "ZOMBIE FACTION ON-PAGE DEBUT — resolves Ed.4 teaser",
          "art_prompt": "SEE art_prompt_pack.json MZ-2026-07-05_P03_PANEL02",
          "negative_prompt": "SEE art_prompt_pack.json MZ-2026-07-05_P03_PANEL02",
          "references_required": ["zombie.png (#1997 faction ref)", "references/background_refs/annex_corridor_plate.png"],
          "lora_required": [],
          "controlnet_required": "depth",
          "seed_strategy": "per_panel"
        },
        {
          "panel_id": "MZ-2026-07-05_P03_PANEL03",
          "panel_size": "third",
          "characters": ["One of the Stayed"],
          "location": "Annex corridor",
          "camera_angle": "extreme close-up",
          "action": "Single zombie face fills panel: huge white eyes, pinprick pupils, rotten grin, brain glinting green",
          "emotion": "pity underneath fear",
          "dialogue": "",
          "caption": "Not everyone walks away. Some monkeys just… stayed.",
          "sfx": "",
          "visual_notes": "Title-drop caption; tragic-funny face; caption box bottom",
          "continuity_notes": "Caption pays off Ed.4 rear-cover line verbatim",
          "art_prompt": "SEE art_prompt_pack.json MZ-2026-07-05_P03_PANEL03",
          "negative_prompt": "SEE art_prompt_pack.json MZ-2026-07-05_P03_PANEL03",
          "references_required": ["zombie.png (#1997 faction ref)"],
          "lora_required": [],
          "controlnet_required": "",
          "seed_strategy": "per_panel"
        }
      ]
    },
    {
      "page_number": 4,